{
  "schema": "solodesk.verification.toolchain",
  "schema_version": 1,
  "id": "F002-toolchain-v1",
  "runtime": {
    "node": "24.21.0",
    "npm": "11.19.0"
  },
  "packages": {
    "oxlint": "1.88.0",
    "spdx-expression-parse": "5.0.0",
    "electron": "44.8.0",
    "playwright": "1.64.1"
  },
  "actions": {
    "actions/checkout": "fbc6f3992d24b796d5a048ff273f7fcc4a7b6c09",
    "actions/setup-node": "a0853c24544627f65ddf259abe73b1d18a591444",
    "actions/upload-artifact": "ea165f8d65b6e75b540449e92b4886f43607fa02",
    "actions/download-artifact": "d3f86a106a0bac45b974a628896c90dbdf5c8093"
  },
  "cli_binaries": [
    {
      "name": "gitleaks",
      "version": "8.30.1",
      "platform": "linux-x64",
      "url": "https://github.com/gitleaks/gitleaks/releases/download/v8.30.1/gitleaks_8.30.1_linux_x64.tar.gz",
      "sha256": "551f6fc83ea457d62a0d98237cbad105af8d557003051f41f3e7ca7b3f2470eb"
    },
    {
      "name": "actionlint",
      "version": "1.7.12",
      "platform": "linux-x64",
      "url": "https://github.com/rhysd/actionlint/releases/download/v1.7.12/actionlint_1.7.12_linux_amd64.tar.gz",
      "sha256": "8aca8db96f1b94770f1b0d72b6dddcb1ebb8123cb3712530b08cc387b349a3d8"
    }
  ],
  "runner_images": [
    {
      "id": "linux-x64",
      "label": "ubuntu-24.04",
      "os": "linux",
      "arch": "x64"
    },
    {
      "id": "windows-x64",
      "label": "windows-2025",
      "os": "win32",
      "arch": "x64"
    },
    {
      "id": "macos-arm64",
      "label": "macos-15",
      "os": "darwin",
      "arch": "arm64"
    }
  ],
  "review_ref": "Authenticated official release/commit metadata inspected 2026-10-18; actual execution records image versions separately",
  "updated_at": "2026-10-18T00:00:00Z"
}
